"","Category","dbID","siteID","SiteName","SubTitle","Lat","Lon","Desc","Sview","Sviewlat","Sviewlong","Heading","Zoom","Pitch","top","mapzoom","sponsor","Categ","ImageN","Image1","Image2","Image3","Image4"
"369","Rocks and Minerals","340","S57","Red Rocks","","43.127675",-79.05710833,"Arizona has a lot of red rock but so too does Ontario (See <a href=""/S24"">S24</a>). The trail down from Niagara Glen (Site <a href=""/S35"">S35</a>) reaches river level close to a superb <a href=""/def/outcrop"">Outcrop</a> of the bright red Queenston <a href=""/def/shale"">Shale</a> where it overlain by the Whirlpool <a href=""/def/sandstone"">Sandstone</a>. See also sites <a href=""/S53"">S53</a> and <a href=""/S58"">S58</a>. The <a href=""/def/shale"">Shale</a> was deposited about 400 million years ago in a shallow sea that was filled in by rivers bringing in enormous volumes of<a href=""/def/_sand ""> Sand </a>from high mountains whose stumps are now the Appalachians. Look for '<a href=""/def/cross-bedding"">Cross-bedding</a>' and ripples on fallen blocks of <a href=""/def/sandstone"">Sandstone</a> which record the movement of<a href=""/def/_sand ""> Sand </a>in an ancient river flowing north into what is now Ontario.","n",NA,NA,NA,NA,NA,"n",16,"",5,NA,"sitePictures/s57a.png","sitePictures/s57b.png","sitePictures/s57c.png","sitePictures/s57d.png"
"370","Rocks and Minerals","341","S58","Art Park","","43.161175",-79.04418056,"Art Park is one of western New York's premier centres for the performing arts and lies on the US side of Niagara Gorge right opposite Queenston Heights close to the historic town of Lewiston, New York. Trails from Art Park lead upstream inside the Gorge following the route taken by an electric railway until it was closed by a rock fall. Look out for the distinctive overhanging cap of the Whirlpool <a href=""/def/sandstone"">Sandstone</a> where it rests on the much softer and bright red Queenston <a href=""/def/shale"">Shale</a> below. For the equivalent Canadian <a href=""/def/outcrop"">Outcrop</a>, go to site <a href=""/S57"">S57</a>. ","n",NA,NA,NA,NA,NA,"n",16,"",5,NA,"sitePictures/s58a.png","sitePictures/s58b.png","sitePictures/s58c.png","sitePictures/s58d.png"
"371","Earth History","342","S59","Earthquake!","","43.5695",-79.693,"Large earthquakes 440 million years ago are recorded by strangely bent <a href=""/def/sandstones"">Sandstones</a> of the Georgian Bay<a href=""/def/_formation ""> Formation </a>exposed along the Credit River just downstream from the Eglinton Avenue road bridge in Mississauga These rocks formed as flat layers on an ancient ocean floor but were contorted into round, weirdly shaped masses called ""pillows"" when the seafloor was violently shaken by earthquakes.","n",NA,NA,NA,NA,NA,"n",16,"",1,NA,"sitePictures/s59a.png","sitePictures/s59b.png","sitePictures/s59c.png","sitePictures/s59d.png"
"372","Historic","343","S60","The Air Canada Center","","43.644154",-79.378452,"The Air Canada Centre retains the old Canada Post Office Building constructed in 1941. Its exterior is decorated with beautifully carved panels of Queenston <a href=""/def/limestone"">Limestone</a> but which had deteriorated as a result of <a href=""/def/dissolution"">Dissolution</a> of the rock by acid rain as a con<a href=""/def/sequence"">Sequence</a> of the growth of the<a href=""/def/_mineral ""> Mineral </a><a href=""/def/gypsum"">Gypsum</a> (calcium sulphate). This creates 'blooms' on rock surfaces eventually leading to its disintegration and spalling. The panels have been restored and a display inside the building tells the story.","y",NA,NA,224.64,0,-30.29,"n",16,"",3,NA,"sitePictures/s60a.png","sitePictures/s60b.png","sitePictures/s60c.png","sitePictures/s60d.png"
"373","Historic","344","S61","CN Tower","","43.642069",-79.38578,"The CN Tower was completed in 1975, is 550 metres high and contains 40,523 tonnes of concrete and weighs a total of 117,000 tonnes. It is made of a hollow 'Y' construction which allows elevators and a stairwell to be placed inside and steel cables to be strung from top to bottom to help resist swaying in high winds and earthquakes. Its foundation lies 15 metres below the ground and consists of 6 metres thick concrete feet excavated into <a href=""/def/shales"">Shales</a> of the Georgian Bay Formation, much of it was done by hand to prevent disturbance of the surrounding rock. Other steel cables are laid horizontally across its base to prevent tensile <a href=""/def/stresses"">Stresses</a> resulting from spreading of the foundation.  ","y",NA,NA,308.48,0,-52.47,"n",16,"",3,NA,"sitePictures/s61a.png","sitePictures/s61b.png","sitePictures/s61c.png","sitePictures/s61d.png"
"374","Historic","345","S62","Convocation Hall","","43.66076389",-79.39533611,"Convocation Hall on the St.George Campus of University of Toronto is built of bricks that were made at the Don Valley Brickyard from mud-rich rocks (<a href=""/def/shales"">Shales</a>) of the Georgian Bay Formation. A display at the newly renovated Brickworks site on Bayview Avenue (Site <a href=""/S15"">S15</a>) shows how much of the early skyline of Toronto was the product of Din Valley Brickworks.","y",43.660806,-79.394953,249.84,0,-15.97,"n",17,"b",3,NA,"sitePictures/s62a.png","sitePictures/s62b.png","sitePictures/s62c.png","sitePictures/s62d.png"
"375","Rocks and Minerals","346","S63","Devonian Square","","43.657563",-79.379786,"<a href=""/def/devonian"">Devonian</a> Square at 350 Victoria Street just east of Yonge Street in downtown Toronto is a great place to stop, buy a coffee, and hang out among big rocks. Huge glacial <a href=""/def/erratic"">Erratic</a> boulders some weighing 100 tons or more sit in a pond in summer which is converted to a skating rink in winter. Enjoy rocks of the Canadian <a href=""/def/shield"">Shield</a> without ever leaving the city.","y",NA,NA,88.71,0,-5.59,"n",17,"",5,NA,"sitePictures/s63a.png","sitePictures/s63b.png","sitePictures/s63c.png","sitePictures/s63d.png"
"376","Historic","347","S64","Whitney Block","Queen's Park","43.662745",-79.390158,"This fine example of a neo-gothic style skyscraper of the 1920's built with Queenston <a href=""/def/limestone"">Limestone</a> quarried at the Queenston Quarry. It was completed in 1926 and the tower was added in 1932. Look out for ornaments on the face of the building that depicts Ontario's mining industry. It is located on: 99 Wellesley Street, Toronto.","y",NA,NA,71.4,0,-25.17,"n",16,"",3,NA,"sitePictures/s64a.png","sitePictures/s64b.png","sitePictures/s64c.png","sitePictures/s64d.png"
"377","Historic","348","S65","Royal Ontario Museum","","43.6685",-79.394353,"The Royal Ontario Museum on Bloor Street north of Queen's Park was opened in 1914 as 'the University of the People' and underwent a major expansion in 1933 and more controversially with the addition of the Michael Lee-Chin Crystal in 2007. It has a notable collection of dinosaurs and minerals. 100 Queens Park, Toronto, ON M5S 2C6","y",NA,NA,215.53,0,-15.89,"n",17,"",3,NA,"sitePictures/s65a.png","sitePictures/s65b.png","sitePictures/s65c.png","sitePictures/s65d.png"
"378","Rocks and Minerals","349","S66","Department of Earth Sciences Rock Walk","","43.660369",-79.398861,"The rock walk outside the Department of Earth Sciences on the University of Toronto campus (at the intersection of Russell Street and Huron Street, just north of College and west of Spadina Avenue) has a fine collection of Ontario's most common rock types from the Canadian <a href=""/def/shield"">Shield</a>. These include stretched pebble <a href=""/def/conglomerates"">Conglomerates</a> from near Kaladar (Sites <a href=""/E9"">E9</a>, <a href=""/E10"">E10</a>), and <a href=""/def/nepheline_syenite"">Nepheline Syenite</a> (<a href=""/C62"">C62</a>).","y",NA,NA,304.72,0,3.23,"n",17,"b",5,NA,"sitePictures/s66a.png","sitePictures/s66b.png","sitePictures/s66c.png","sitePictures/s66d.png"
"379","Historic","350","S67","Schoellkopf Geologic Museum","","43.093435",-79.062024,"Schoellkopf Geologic Museum is an excellent place to begin your exploration of the Niagara gorge. An interpretation center explains the origin of the gorge, and access points for hikes. Note the collapsed powerplant that occurs behind the museum site (<a href=""/S48"">S48</a>).","y",43.093104,-79.061533,304.06,0,-2.83,"n",16,"",3,NA,"sitePictures/s67a.png","sitePictures/s67b.png","sitePictures/s67c.png","sitePictures/s67d.png"
"380","Historic","351","S68","A.P Coleman","","43.695137",-79.38485,"A.P. Coleman (1852-1932) was Professor of Geology at the University of Toronto and discovered the warm climate deposits about 100,000 years old in the Don Valley Brickyard (Site <a href=""/S15"">S15</a>). He is also credited with first recognizing the much older (2.4 billion years) glacial deposits of the Gowganda<a href=""/def/_formation ""> Formation </a>in northern Ontario (Sites <a href=""/N8"">N8</a>, <a href=""/N9"">N9</a>, <a href=""/N10"">N10</a>).  Fittingly, his memorial stone in Mount Pleasant Cemetrey in Toronto (Section 20, Lot 98) is a large glacial <a href=""/def/erratic"">Erratic</a> boulder carried south from the Canadian <a href=""/def/shield"">Shield</a> by the last great <a href=""/def/ice_sheet"">Ice sheet</a> to have invaded Ontario about 20,000 years ago. Coleman made the first detailed geology map of the city of Toronto (1913).","n",NA,NA,NA,NA,NA,"n",13,"",3,NA,"sitePictures/s68a.png","sitePictures/s68b.png","sitePictures/s68c.png","sitePictures/s68d.png"
"381","Historic","352","S69","Bancroft Marble at the Guild Inn","","43.747944",-79.191857,"<a href=""/def/marble"">Marble</a> is a very common metamorphic rock across the easternmost part of the Canadian <a href=""/def/shield"">Shield</a> in central Ontario (Sites <a href=""/E2"">E2</a>, <a href=""/E4"">E4</a>, <a href=""/E44"">E44</a>).  Usually it is of too poor quality to quarry as a building stone it has only been rarely used as such with a notable exception. The Bank of Toronto (built in 1912 and demolished in 1966) used <a href=""/def/marble"">Marble</a> from Bancroft (See Site <a href=""/C50"">C50</a>). Columns and friezes are preserved as part of a Greek theatre within the grounds of the Guild Inn in Scarborough now popular as a background for wedding parties.","n",NA,NA,NA,NA,NA,"n",16,"",3,NA,"sitePictures/s69a.png","sitePictures/s69b.png","sitePictures/s69c.png","sitePictures/s69d.png"
"382","Historic","353","S70","Canadian Imperial Bank of Commerce","","43.648799",-79.379203,"This splendid Art Deco building was designed by Pearson and Darling, and finished in 1930. It has a steel frame clad in <a href=""/def/limestone"">Limestone</a>. It was the tallest building in Canada until 1962. ","y",43.648865,-79.379238,122.04,0,-23.84,"n",17,"",3,NA,"sitePictures/s70a.png","sitePictures/s70b.png","sitePictures/s70c.png","sitePictures/s70d.png"
"383","Historic","354","S71","Canadian Volunteers Monument","","43.66265",-79.393342,"Built in 1870 at the eastern boundary of the University of Toronto campus at Queen's Park, to commemorate those men (many of whom were university students) who fought and died at the Battle of Ridgeway against the Fenians during the Fenian Raid of 1866 (Site <a href=""/S40"">S40</a>).","y",43.662694,-79.393064,261.77,0,-3.46,"n",17,"",3,NA,"sitePictures/s71a.png","sitePictures/s71b.png","sitePictures/s71c.png","sitePictures/s71d.png"
"384","Rocks and Minerals","355","S72","College Park","","43.660929",-79.383302,"The old Eaton's Department store on the corner of College and Yonge Streets in Toronto is constructed of the famous 'Tyndall Stone' which is a <a href=""/def/limestone"">Limestone</a> quarried in Manitoba. It is one of the most popular building stones in Canada because of its attractive mottled appearance and warm colour. It was used extensively in the interior of the Parliament Buildings in Ottawa (Site <a href=""/E23"">E23</a>). The mottled appearance is due to '<a href=""/def/bioturbation"">Bioturbation</a>' (mixing) by animals when the <a href=""/def/limestone"">Limestone</a> was still very soft<a href=""/def/_sediment ""> Sediment </a>on an ancient (<a href=""/def/ordovician"">Ordovician</a>) sea floor some 450 million years ago. The branching tube-like marks are burrows left by these organisms mining their way through<a href=""/def/_sediment ""> Sediment </a>in search of food.","y",43.660998,-79.382956,272.42,0,-29.66,"n",17,"",5,NA,"sitePictures/s72a.png","sitePictures/s72b.png","sitePictures/s72c.png","sitePictures/s72d.png"
"385","Historic","356","S73","Crimean Cannon","","43.662031",-79.391783,"The Crimean War between Britain, France, the Ottomans  and Russia lasted from 1853 to 1856 and was famous for the battle of Balak<a href=""/def/lava"">Lava</a> (October 1854), the heroic work of the nurse Florence Nightingale and the prolonged siege from 1854 to 1855 of the city of Sevastopol the capital of the Crimea. Queen Victoria sent a pair of cannon seized at Sevastopol to many important cities in the Empire and Toronto's can be found at the west entrance to Queen's Park. Metal from Sevastopol cannons has traditionally been used in the making of the Victoria Cross, Britain's highest award for gallantry.","y",43.661779,-79.391716,345.69,0,-3.62,"n",16,"",3,NA,"sitePictures/s73a.png","sitePictures/s73b.png","sitePictures/s73c.png","sitePictures/s73d.png"
"386","Historic","357","S74","The Light of Ages","Gibraltar Point Lighthouse","43.613252",-79.38475,"Gibraltar Point Lighthouse built in 1806 on Toronto Islands is the oldest stone building in Toronto. It is made of <a href=""/def/limestone"">Limestone</a> from Queenston and refurbished in 1832 with <a href=""/def/limestone"">Limestone</a> from Kingston (<a href=""/E41"">E41</a>).","y",NA,NA,320.11,1,-6.88,"n",17,"",3,NA,"sitePictures/s74a.png","sitePictures/s74b.png","sitePictures/s74c.png","sitePictures/s74d.png"
"387","Historic","358","S75","Gooderham and Worts Distillery","","43.65073",-79.35977,"This famous distillery was built in 1870 is made of <a href=""/def/limestone"">Limestone</a> shipped in from Kingston (site E41). In the 1920's it was the largest producer of whisky and spirits in Canada taking advantage of prohibition in the US.","y",NA,NA,159.89,0,-8.02,"n",16,"",3,NA,"sitePictures/s75a.png","sitePictures/s75b.png","sitePictures/s75c.png","sitePictures/s75d.png"
"388","Historic","359","S76","Re-inventing the Canadian Shield","The Graphic Arts Building and the Group of Seven","43.650906",-79.382447,"Until 1900, the Canadian <a href=""/def/shield"">Shield</a> was a place to avoid; full of rocks, impossible to farm. As Canada's urban areas grew quickly, the painters of the Group of Seven refashioned the image of the <a href=""/def/shield"">Shield</a> for city dwellers as a place for recreation and solitude. Many of the members of the Group, most notably Tom Thompson, were employed by an advertising company called 'The Grip' housed in the Graphic Arts Building built in 1912 on Adelaide Street in Toronto. It is located on 73 Richmond Street West. ","y",NA,NA,127.37,0,-29.9,"n",17,"",3,NA,"sitePictures/s76a.png","sitePictures/s76b.png","sitePictures/s76c.png","sitePictures/s76d.png"
"389","Historic","360","S77","Hamilton Museum of Steam and Technology","","43.256456",-79.771943,"Today we take clean drinking water for granted but in the 1850's 1 out of every 40 Hamiltonians were dying of cholera from contaminated drinking water. A new clean water supply was needed for the growing city and the solution was to pump water from Lake Ontario. The new pump house with a 45 m high chimney was designed by Thomas Keefer and opened in 1860 driven by two enormous 70 ton Woolf Compound steam engines. These ran until 1910 when electric pumps were installed but remained on stand-by service until 1938. Reconditioned in the 1970's, the pump house was opened as a museum in 1983 and is the last surviving example of a mid-19th century waterworks in North America.  The massive building is constructed of two rock types both found locally along the Niagara <a href=""/def/escarpment"">Escarpment</a>: Eramosa <a href=""/def/dolostone"">Dolostone</a>, and grey-coloured Whirlpool. You can find the Museum on 900 Woodward Avenue.","y",43.25649,-79.772898,84.89,0,-15.73,"n",16,"",3,NA,"sitePictures/s77a.png","sitePictures/s77b.png","sitePictures/s77c.png","sitePictures/s77d.png"
"390","Historic","361","S78","Hart House","University of Toronto","43.66375",-79.394444,"Financed by Vincent Massey at a total cost of $2 million a very large sum in the early twentieth century the Gothic design is intended to convey the authority and monumental solidity of European cathedrals. It is used as student centre with a famous theatre and debating club.  Soldiers' Tower completed in 1924 reminds us of the contribution made by University of Toronto students, staff and faculty who made the ultimate sacrifice in two World Wars. The cannons are from the French fortress of Louisbourg on Cape Breton Island, Nova Scotia, taken by the British in 1758; they were last fired in 1929 as a prank by engineering students.","y",43.663592,-79.394135,286.36,0,-12.82,"n",16,"b",3,NA,"sitePictures/s78a.png","sitePictures/s78b.png","sitePictures/s78c.png","sitePictures/s78d.png"
"391","Rocks and Minerals","362","S79","The Limestone Hockey Player","Ryerson University","43.658003",-79.378809,"The expression 'hands like stones' is often used in ice hockey for unskilled players. The player carved in 1962 out of Queenston <a href=""/def/limestone"">Limestone</a> quarried from the Niagara <a href=""/def/escarpment"">Escarpment</a> decorating the southeastern entrance to the Quadrangle at Ryerson University certainly has hands of stone. Fittingly, it occurs two blocks away from Maple Leaf Gardens the former home of Toronto's NHL team.","y",NA,NA,357.6,2,-23.33,"n",16,"",5,NA,"sitePictures/s79a.png","sitePictures/s79b.png","sitePictures/s79c.png","sitePictures/s79d.png"
"392","Historic","363","S80","McMaster Hall","","43.668182",-79.396372,"This impressive building at 273 Bloor Street West was constructed in 1881 to house McMaster College (the precursor to McMaster University in Hamilton established in 1930). It is built of red and grey colored Whirlpool <a href=""/def/sandstone"">Sandstone</a> from the base of the Niagara <a href=""/def/escarpment"">Escarpment</a> at Forks of the Credit (Site <a href=""/S51"">S51</a>). Today it is the home of the Royal Conservatory of Music","y",NA,NA,161.51,0,-17.78,"n",16,"b",3,NA,"sitePictures/s80a.png","sitePictures/s80b.png","sitePictures/s80c.png","sitePictures/s80d.png"
"393","Historic","364","S81","The New Face of Education","Toronto Normal and Model School at Ryerson University","43.658052",-79.379077,"The quadrangle at Ryerson University just east of Yonge Street, Toronto contains a striking façade of the original building that housed the first school for the formal training of school teachers in Ontario under the leadership of Egerton Ryerson. A 'Normal' school is meant to train teachers to teach students towards the social 'norm'.","y",43.657954,-79.379013,351.56,0,-16.99,"n",16,"",3,NA,"sitePictures/s81a.png","sitePictures/s81b.png","sitePictures/s81c.png","sitePictures/s81d.png"
"394","Historic","365","S82","Queen's Park","","43.662159",-79.391601,"Ontario's Legislative Building (aka 'the Pink Palace') is an iron-framed building clad in 'Credit Valley Red' <a href=""/def/sandstone"">Sandstone</a> of the <a href=""/def/silurian"">Silurian</a> Whirlpool<a href=""/def/_formation ""> Formation </a>cut from former quarries at the Forks of the Credit near the base of the Niagara <a href=""/def/escarpment"">Escarpment</a>. It was completed in 1893 (with several modifications since) and houses the Provincial Legislature. Given the closure of the quarries that cut this distinctively hued <a href=""/def/sandstone"">Sandstone</a>, the northern part of the building added in 1909 was made out of Sackville <a href=""/def/sandstone"">Sandstone</a> from New Brunswick which has a noticeably different deeper red coloration. The building is noted for its many ornate decorations reflecting the ease at which the Whirlpool could be carved; it was also used to great effect elsewhere in downtown Toronto in the construction of Old City Hall, at Victoria College (Site <a href=""/S88"">S88</a>) and McMaster Hall (Site <a href=""/S80"">S80</a>).","y",43.661861,-79.39151,352.76,0,-23.76,"n",16,"",3,NA,"sitePictures/s82a.png","sitePictures/s82b.png","sitePictures/s82c.png","sitePictures/s82d.png"
"395","Historic","366","S83","Royal Magnetic and Meteorological Observatory","","43.663139",-79.394993,"This was built of Kingston <a href=""/def/limestone"">Limestone</a> (Site <a href=""/E41"">E41</a>) in 1855 near Convocation Hall on the campus of the University of Toronto but was moved in 1907 to its present location near Hart House (Site <a href=""/S79"">S79</a>). It is associated with the astronomer John Henry Lefroy who in the 1840 helped establish the position of the north magnetic pole in northern Canada. This famous building now houses the administration for the Students' Council.","y",NA,NA,82.13,0,0,"n",16,"b",3,NA,"sitePictures/s83a.png","sitePictures/s83b.png","sitePictures/s83c.png","sitePictures/s83d.png"
"396","Rocks and Minerals","367","S84","Spanish Quartzite at Queen's Park","","43.661965",-79.392834,"Gandesa in eastern Spain was the site of the 1938 Spanish Civil War battle between the fascist nationalist forces of General Franco and Republican forces which included the International Brigade drawn from volunteers from the UK, Canada and the USA. A block of pink Gandesa <a href=""/def/quartzite"">Quartzite</a> on the northwestern corner of Queen's Park in Toronto commemorates the contributions of Canadian volunteers in the battle.  ","y",NA,NA,211.34,0,-1.65,"n",16,"",5,NA,"sitePictures/s84a.png","sitePictures/s84b.png","sitePictures/s84c.png","sitePictures/s84d.png"
"397","Historic","368","S85","The Griffin","","43.662159",-79.391601,"The griffin is a mythical winged creature with an eagle-like beak and body like that of a lion, and has long been used as a symbol of vigilance and protection. It is derived from the Middle East (from Ancient Persia) where there are stories of such creatures with nests made of gold guarding the rocks and minerals of their territory. Consequently it is widely used on buildings as a symbolic safeguard of its contents and inhabitants. It is common on many old Toronto buildings most notably on the southern face of Queen's Park carved in Credit Valley Red <a href=""/def/sandstone"">Sandstone</a> (Site <a href=""/S51"">S51</a>).","y",NA,NA,330.47,2,-18.61,"n",16,"",3,NA,"sitePictures/s85a.png","sitePictures/s85b.png","sitePictures/s85c.png","sitePictures/s85d.png"
"398","Historic","369","S86","Toronto Stock Exchange","","43.647834",-79.379911,"Though made out of Indiana <a href=""/def/limestone"">Limestone</a> (which superficially resembles Ontario's Queenston <a href=""/def/limestone"">Limestone</a>) the friezes on the exterior of the classic Art Deco building finished in 1924 are of some note and amusement.  Carved by Charles Comfort they depict the principal resources of Canada including a banker with his hand seemingly in the pocket of a miner.  It was the first air-conditioned building in Canada. It is located on 234 Bay Street.","y",43.647914,-79.379942,275.73,0,-38.08,"n",16,"",3,NA,"sitePictures/s86a.png","sitePictures/s86b.png","sitePictures/s86c.png","sitePictures/s86d.png"
"399","Historic","370","S87","University College","University of Toronto","43.662598",-79.395404,"Built in 1856-9 to house the University of Toronto this impressive building said to be of Romanesque design, is made predominantly of Ohio <a href=""/def/sandstone"">Sandstone</a> from the USA with pale-colored Whirlpool <a href=""/def/sandstone"">Sandstone</a> of <a href=""/def/silurian"">Silurian</a> age quarried from the base of the Niagara <a href=""/def/escarpment"">Escarpment</a> near Forks of the Credit (See Site <a href=""/S51"">S51</a>) and <a href=""/def/sandstone"">Sandstone</a> from Ohio. Note the highly decorated Norman arch above the main entranceway.","y",43.661065,-79.394878,336.91,0,-5.27,"n",17,"b",3,NA,"sitePictures/s87a.png","sitePictures/s87b.png","sitePictures/s87c.png","sitePictures/s87d.png"
"400","Historic","371","S88","Victoria College","University of Toronto","43.666944",-79.391944,"Victoria College was formerly based in Cobourg, Ontario before moving to the University of Toronto in 1892. The centre piece of the Victoria College on the northeast side of Queen's Park Crescent in Toronto is a resplendent building in the Romanesque style made of red colored 'Credit Valley Red' (Site <a href=""/S51"">S51</a>) of <a href=""/def/silurian"">Silurian</a> age from the base of the Niagara <a href=""/def/escarpment"">Escarpment</a> though Triassic <a href=""/def/sandstone"">Sandstone</a> ('brownstone' ) was also used. The Credit Valley <a href=""/def/sandstone"">Sandstone</a> is relatively soft and was much favored for carving by stone masons.  It is no longer obtainable and the Sackville <a href=""/def/sandstone"">Sandstone</a> from New Brunswick has been used for repairs.","y",43.667518,-79.392183,154.25,0,0,"n",16,"b",3,NA,"sitePictures/s88a.png","sitePictures/s88b.png","sitePictures/s88c.png","sitePictures/s88d.png"
"401","Historic","372","S89","W.A. Parks","","43.667463",-79.393911,"No reference to building stones in Ontario would be complete without reference to W.A. Parks whose work is commemorated by a plaque outside the front entrance to the Royal Ontario Museum (Site <a href=""/S65"">S65</a>). He identified the many rock types across the <a href=""/def/province"">Province</a> that could be used for construction.","y",NA,NA,264.6,0,-6.45,"n",16,"",3,NA,"sitePictures/s89a.png","sitePictures/s89b.png","sitePictures/s89c.png","sitePictures/s89d.png"
