"","Category","dbID","siteID","SiteName","SubTitle","Lat","Lon","Desc","Sview","Sviewlat","Sviewlong","Heading","Zoom","Pitch","top","mapzoom","sponsor","Categ","ImageN","Image1","Image2","Image3","Image4"
"116","Historic","116","C116","Great Canadian Uranium Rush","Bancroft and the Nuclear Industry","45.002005",-78.049882,"By the early 1950's uranium had become a strategic mineral, of global importance but limited supply. The American nuclear program was in full swing among Cold War tensions and generous government incentives promoted exploration in central Canada; the uranium boom was on especially during the period 1952-4 when there was frantic activity. Staking of <a href=""/def/pegmatite"">Pegmatite</a> dikes occurred in the Bancroft district and four short lived mines were opened and operated at Bicroft (1956 - 1963 near Monck road and Highway 118), Faraday (1957-1964, on the Madawaska Mine loop road), Greyhawk (1957-1959 on Highway 28) and Canadian Dyno mines (1958-1960). It was a very brief industry as the US had found its own domestic supplies by the end of the decade. By 1964 it was all over and the focus had switched to the nuclear generation of electricity such as Pickering which was announced in 1964 and began operating in 1971 but new global supplies meant the Bancroft mines stayed closed. The Faraday Mine opened in 1975 as the Madawaska Mine but finally closed in 1982. The uranium finds of the late 1940's focused on <a href=""/def/igneous_intrusion"">Igneous intrusion</a>s such as steeply dipping (50 to 60 degrees) <a href=""/def/pegmatite"">Pegmatite</a> dikes (Site <a href=""/C110"">C110</a>). ","y",45.002005,-78.049882,112.93,0,-1.48,"n",16,"a",3,NA,"sitePictures/c116a.png","sitePictures/c116b.png","sitePictures/c116c.png","sitePictures/c116d.png"
"117","Historic","117","C117","The Naming of Bancroft","","45.055855",-77.855146,"Rivers were significant corridors of trade and transportation across the Ontario Highlands in the early years when there were few roads. Bancroft was originally named 'York Mills'. Rich stands of hemlock and pine were a magnet to early settlers in the Bancroft area and the first log drive along the York River through Bancroft (renamed as such in 1879) was in 1854 and the last was in 1926 supplying squared timber for ship builders in Britain.","y",45.055855,-77.855146,334.97,0,1.7,"n",13,"a",3,NA,"sitePictures/c117a.png","sitePictures/c117b.png","sitePictures/c117c.png","sitePictures/c117d.png"
"118","Historic","118","C118","Bancroft Station","","45.058441",-77.859036,"The first railway reached Bancroft in 1900 as a direct route to the gold fields of North Hastings passing through Coe Hill where an iron mine operated from 1882 to 1887.  The Bessemer Mine opened in 1900 to mine iron and lay on a spur line delivering iron <a href=""/def/ore"">Ore</a> to Pittsburgh until 1912. Rather than minerals however, lumber was the main material that was shipped out by rail. The line was taken over by Canadian National Railways in 1956 and the Bancroft station was in operation until 1975.","n",NA,NA,NA,NA,NA,"n",13,"a",3,NA,"sitePictures/c118a.png","sitePictures/c118b.png","sitePictures/c118c.png","sitePictures/c118d.png"
"119","Rocks and Minerals","119","C119","Perthite","","44.810324",-76.219629,"This is the name given by mineralogists to thin, curving microscopic layers of sodic plagioclase feldspar found mixed within alkali feldspar such as orthoclase or microcline. It can be seen by the naked eye in <a href=""/def/pegmatite"">Pegmatite</a> dikes characterized by their large crystals in the Bancroft area. The name was introduced by Dr. James Wilson a doctor living near the town of Perth from discoveries he made in 1843 on a farm on the west shoreline of Adam Lake. Perthite is not a new <a href=""/def/mineral"">Mineral</a> type but a new variant of two already known feldspar minerals.","n",NA,NA,NA,NA,NA,"n",15,"a",5,NA,"sitePictures/c119a.png","sitePictures/c119b.png","sitePictures/c119c.png","sitePictures/c119d.png"
"120","Rocks and Minerals","120","C120","Discovery of Uranium","Fission Lake","45.0566",-78.1797,"W.M. Richardson is credited with the first finding in 1922 of black pitchblende (The<a href=""/def/mineral"">Mineral</a>Uraninite) near Wilberforce near the north end of Highway 648 loop. On testing it was found to contain 59% of uranium oxide which would produce about 150 milligrams of radium per ton. By the mid-1950's exploration was widespread with activity on some 150 properties but few were developed as mines. The Richardson property (later known as the Fission Mine) is east of Wilberforce and is noted for some of the largest crystals of uraninite ever found in Canada","n",NA,NA,NA,NA,NA,"n",13,"a",5,NA,"sitePictures/c120a.png","sitePictures/c120b.png","sitePictures/c120c.png","sitePictures/c120d.png"
"121","Historic","121","C121","Gooderham","","44.973056",-78.275131,"This community was built along Gooderham Lake, bordered on the south by the Irondale River and Pine Lake to the north, located on a now defunct railway line, the IB&O Railroad, which has been since converted into a trail network. First settled in 1873, its main industry was logging. ","y",44.973056,-78.275131,202.16,0,4.87,"n",15,"a",3,2,"sitePictures/c121a.png","sitePictures/c121b.png","sitePictures/c121c.png","sitePictures/c121d.png"
"122","Nature","122","C122","Ontario's Grasslands","","44.405335",-77.590581,"Much <a href=""/def/limestone"">Limestone</a> area south of Highway 7 between Havelock and Madoc are now bare grasslands. Their thin soils inhibit cultivation and growth. Many farms cleared in the 19th century are now abandoned and going back to bush creating a unique landscape. Areas further south have a thicker <a href=""/def/sediment"">Sediment</a> cover in the form of large <a href=""/def/drumlin"">Drumlin</a>s (eg. Peterborough <a href=""/def/drumlin"">Drumlin</a> Field <a href=""/C42"">C42</a>).","y",44.405335,-77.590581,13.72,0,-5.46,"n",15,"a",4,1,"sitePictures/c122a.png","sitePictures/c122b.png","sitePictures/c122c.png","sitePictures/c122d.png"
"123","Historic","123","C123","Cardiff","","44.992393",-78.014974,"This community can claim to be the former centre of the uranium industry in the Bancroft area as provided housing for the nearby Bicroft and Canadian Dyno mines which closed in the early 1960's. The Bicroft Mine tailings pile is can be seen from Highway 118 across from Center Lake. The Dyno mine site still contains remnants of the original mill and crusher and can be seen from Dyno Road. ","y",44.99218,-78.015794,15.78,0,-4.28,"n",15,"a",3,1,"sitePictures/c123a.png","sitePictures/c123b.png","sitePictures/c123c.png","sitePictures/c123d.png"
"124","Rocks and Minerals","124","C124","Straight Gneiss on Highway 60","","45.35583",-79.049512,"This is the name given to highly metamorphic rocks (<a href=""/def/gneiss"">Gneiss</a>) that are beautifully banded but where each band is remarkably consistent over many tens of metres. This can only form at great depths (about 25 kilometres) where the rock was being deformed (squeezed and sheared) under great temperature (about 750 degrees celcius) and <a href=""/def/pressure"">Pressure</a> (up to 7 kilobars or 7000 times atmospheric <a href=""/def/pressure"">Pressure</a>!) and where deformation and ductile flow was maintained at a constant rate. Such rocks are very common across the Central <a href=""/def/gneiss"">Gneiss</a> Belt of Central Ontario from Georgian Bay to Haliburton. There are many <a href=""/def/outcrop"">Outcrop</a>s of straight <a href=""/def/gneiss"">Gneiss</a> on Highway 60 just east of the junction with Muskoka Road 3 immediately east of Huntsville and throughout the Lake of Bays area. ","y",45.35583,-79.049512,3.4,0,-1.26,"n",14,"a",5,1,"sitePictures/c124a.png","sitePictures/c124b.png","sitePictures/c124c.png","sitePictures/c124d.png"
"125","Historic","125","C125","The Perth Museum","","44.900995",-76.250766,"This is located in Matheson House is noted for the large geological collection assembled by Archibald Campbell and by James Wilson (Site <a href=""/C126"">C126</a>). Roderick Matheson was a prominent local merchant and friend of Wilson and also his business partner in Canada's first apatite mine (near Otty Lake). When Wilson retired to his native Scotland in 1869, he left his geological collection with Matheson. Years later, Roderick's son, Colonel Allan Matheson, donated the collection to the Perth Museum.","y",44.900995,-76.250766,68.07,0,-11.44,"n",14,"a",3,1,"sitePictures/c125a.png","sitePictures/c125b.png","sitePictures/c125c.png","sitePictures/c125d.png"
"126","Historic","126","C126","Dr. James Wilson","","44.899278",-76.248722,"Wilson (1798-1881) was a Scottish medic who set up practice in Perth in 1821. As he traveled between housecalls in a horse-drawn buggy he would study the local geology in numerous <a href=""/def/outcrop"">Outcrop</a>s along his route. He became such an expert that when his Edinburgh schoolmate, William E. Logan, was engaged as the first director of the Geological Survey of Canada in 1842, Wilson was one of the first people Logan called upon to give him the lay of the land. This amateur/professional relationship continued for many years, resulting in several notable scientific discoveries celebrated today by displays at Perth Museum (Site <a href=""/C125"">C125</a>).","y",44.899278,-76.248722,226.29,0,-28.87,"n",15,"a",3,1,"sitePictures/c126a.png","sitePictures/c126b.png","sitePictures/c126c.png","sitePictures/c126d.png"
"127","Rocks and Minerals","127","C127","The Hastings Highlands","Early Understanding of the Canadian Shield","45.246692",-77.947323,"The complexity of the highly deformed Grenville <a href=""/def/province"">Province</a> rocks of the Canadian <a href=""/def/shield"">Shield</a> in eastern Ontario especially around Bancroft was baffling to early geologists more used to working with much younger flat-lying <a href=""/def/sedimentary_rock"">Sedimentary rock</a>s with fossils to aid <a href=""/def/correlation"">Correlation</a>s. The rocks were complex and the area was very difficult to work in with no roads and dense forests. Early ideas were that the <a href=""/def/shield"">Shield</a> was simply cooled <a href=""/def/crust"">Crust</a> in keeping with the notion of a once molten planet. Observations of the deformed <a href=""/def/marble"">Marble</a>s of the Hastings Highlands in the 1850's by Sir William Logan and others area resulted in the new notion that much rock had been sedimentary in origin but much altered by <a href=""/def/metamorphism"">Metamorphism</a> (Sites <a href=""/C115"">C115</a>). The term'Hastings Series' was used in the 1860's to refer to such <a href=""/def/strata"">Strata</a>.  Final understanding about 100 years later had to await the identification of'terranes' or large blocks of rock that formerly had been small landmasses or islands made up of sedimentary <a href=""/def/strata"">Strata</a> and all brought together and deformed by plate tectonic processes about 1 billion years ago during<a href=""/def/_formation ""> Formation </a>of the Grenville Mountains and the <a href=""/def/supercontinent"">Supercontinent</a> <a href=""/def/rodinia"">Rodinia</a>.","y",45.246692,-77.947323,86.93,0,0.96,"n",13,"a",5,NA,"sitePictures/c127a.png","sitePictures/c127b.png","sitePictures/c127c.png","sitePictures/c127d.png"
"128","Historic","128","C128","Halls Lake Log Chute","","45.149389",-78.728377,"Here in the Haliburton Highlands is an amazingly preserved piece of Ontario's logging history, a narrow wooden trough funneling fast-flowing water designed to carry logs down the Gull River during the<a href=""/def/_spring ""> Spring </a>breakup and thaw. Built in 1861 <a href=""/def/spring"">Spring</a> runoff ponded up behind the dam was released to create a flood capable of carrying heavy logs downriver from sprawling pine forests. A chute was in operation here between 1861 and the 1930's when the supply of logs began to dwindle. The present chute was made in 1999 of sawn hemlock and is the best preserved anywhere in the <a href=""/def/province"">Province</a>.  An interpretive display outlines the area's rich legacy of logging; also visit the Heritage Discovery Museum in nearby Stanhope. At one time there were hundreds of log chutes across Ontario but nearly all exist in name only (e.g., <a href=""/C54"">C54</a>).  ","n",NA,NA,NA,NA,NA,"n",14,"a",3,2,"sitePictures/c128a.png","sitePictures/c128b.png","sitePictures/c128c.png","sitePictures/c128d.png"
"129","Historic","129","C129","The Great Depression","Beginning of the Cottage Boom","44.490367",-78.236135,"In 1933 there were several camps set up in the Bancroft area to provide relief work for the unemployed. These men were paid about a $1 a day to work on improving the original colonization roads (Hastings Road, Monck Road, Paudash and Burleigh Roads) which had been cut in the 19th century to ease the movement of settlers onto the southern margins of the Canadian Shield. The original purpose had been unsuccessful because there was limited farmland on the Shield (Sites <a href=""/C21"">C21</a>, <a href=""/C48"">C48</a>) but the upgrades made to the roads in the 1930s and the widening ownership of cars attracted the first cottagers to the Highlands. The recreation boom had begun and a new type of seasonal settler had arrived.","y",44.487631,-78.238753,252.58,0,-0.89,"n",14,"a",3,2,"sitePictures/c129a.png","sitePictures/c129b.png","sitePictures/c129c.png","sitePictures/c129d.png"
"130","rocks & minerals","","C137","Complex drumlins of the Peterborough Drumlin Field","","44.15589",-78.25882,"This area is well known for the presence of ‘complex drumlins’ within the axis of the PDF which lies north and west of Rice Lake toward the City of Peterborough. This area illustrates how large ovoid drumlins evolve into ‘conjoined flutes’ of various planforms as the drumlinized till bed was lowered and dissected by subglacial erosion below fast flowing ice.  Prominent grooves visible on the flanks of drumlins and straightened drumlin margins may record erosion of larger more ovoid drumlins by erosive streams of remobilised subglacial debris being moved to the ice margin.","n",NA,NA,NA,NA,NA,"n",14,"",4,1,"sitePictures/C137a.png","sitePictures/C137b.png","sitePictures/C137c.png","sitePictures/C137d.png"
"131","Earth History","","C138","Peterborough Drumlin Field","Viewpoint","44.15016",-78.31527,"The Peterborough Drumlin Field (PDF) lies within a broad bedrock depression defined by regional block faulting of Paleozoics by reactivation of underlying Precambrian basement. This depression may have been instrumental in trapping glaciolacustrine sediment prior to Late Wisconsin expansion of the Ontario Lobe allowing the formation of thick till when overridden as the ice sheet expanded (see site ).  This site affords a view to the northwest across the axis of the PDF to its western limit defined by rising ground likely resulting from regional block faulting of underlying Precambrian basement structures. The PDF occupies a broad depression and this likely played a role in allowing accumulation of thick glaciolacustrine sediments prior to the Late Wisconsin maximum; much of this has been reworked with limestone debris quarried and plucked form limestone escarpments on the hard bed to the north, creating thick till (Northern Till).  Several workers have pointed out that drift drumlins are cut across this till and appear to be erosional in origin related to late stage fast ice flow (sites <a href=""/C139"">C139</a>, <a href=""/C140"">C140</a>, <a href=""/C141"">C141</a>, <a href=""/C142"">C142</a>, <a href=""/C143"">C143</a>, <a href=""/C144"">C144</a>).","n",NA,NA,NA,NA,NA,"n",14,"",6,1,"sitePictures/C138a.png","sitePictures/C138b.png","sitePictures/C138c.png","sitePictures/C138d.png"
"132","rocks & minerals","","C139","Bisected drumlin","","44.2812",-77.71682,"Highway 8 cuts across an excellent example of a large ovoid drumlin.","y",44.2812,-77.71682,65.33824773,0,-12.79378395,"n",14,"",4,1,"sitePictures/C139a.png","sitePictures/C139b.png","sitePictures/C139c.png","sitePictures/C139d.png"
"133","rocks & minerals","","C140","Till on silt core of drumlin","","44.371778",-78.096389,"Elongate drumlin along axis of Peterborough Drumlin Field showing till resting erosively on core of glaciolacustrine silt. This illustrates the importance of incorporation of mixing of fine sediment with limestone debris to create till (see sites <a href=""/E69"">E69</a>, <a href=""/C143"">C143</a>, <a href=""/C144"">C144</a>)","y",44.371778,-78.096389,35.75836585,0,-12.49167453,"n",14,"",4,2,"sitePictures/C140a.png","sitePictures/C140b.png","sitePictures/C140c.png","sitePictures/C140d.png"
"134","Earth History","","C141","Keene Drumlin","","44.3042",-78.213192,"This large pit exposes the core of a large elongated drumlin along the axis of the Peterborough Drumlin Filed (PDF).  A till carapace of varying thickness truncates subaqueously-deposited outwash and fine-grained glaciolacustrine facies. These deposits occur widely below the PDF and were mixed with limestone debris to form the thick tills within drumlins (sites <a href=""/E69"">E69</a>, <a href=""/C143"">C143</a>, <a href=""/C144"">C144</a>). This exposure is in the area of the PDF where larger ovoid drumlins have been straightened and elongated by faster ice flow velocities along the axis of the Peterborough Drumlin Field.

This is a gated private quarry and permission must be obtained from the owner to enter the site","n",NA,NA,NA,NA,NA,"n",14,"",6,1,"sitePictures/C141a.png","sitePictures/C141b.png","sitePictures/C141c.png","sitePictures/C141d.png"
"135","rocks & minerals","","C142","Drumlin exposure south of Burnley:  Haldiman Township Pit #1","","44.140132",-78.002878,"This pit exposes the glaciofluvial-glaciolacustrine gravel and sand core of a large 20 m high ovoid drumlin. A till carapace is lacking and drumlin surface truncates the core suggesting an entirely erosional origin.

This is a gated private quarry and permission must be obtained from the owner to enter the site","y",44.140045,-78.002825,84.74717495,2,-7.229734371,"n",14,"",4,2,"sitePictures/C142a.png","sitePictures/C142b.png","sitePictures/C142c.png","sitePictures/C142d.png"
"136","rocks & minerals","","C143","Till of drumlin crest southwest of Warkworth on Hiway 29","","44.17192",-77.91826,"This till is typical of the matrix-rich tills found within drumlins of the Peterborough Drumlin Field reflecting mixing of limestone debris derived from the limestone plains to the north with fine sediment overrun by the ice sheet (contrast with Sites <a href=""/E69"">E69</a>, <a href=""/C144"">C144</a>).","n",NA,NA,NA,NA,NA,"n",14,"",4,2,"sitePictures/C143a.png","sitePictures/C143b.png","sitePictures/C143c.png","sitePictures/C143d.png"
"137","rocks & minerals","","C144","Drumlin with stony till","","44.3159",-77.66693,"Drumlins in the northernmost reaches of the Peterborough Drumlin Field immediately downglacier of the limestone plains to the north often show stony ‘immature’ till dominated by limestone debris with a silt sand matrix. Further south tills become more fine grained as a result of extended glacial transport and mixing with pre-existing fine sediment below the drumlin field (e.g., Sites <a href=""/C140"">C140</a>, <a href=""/C143"">C143</a>).","y",44.3159,-77.66693,196.8602752,0,-27.1919257,"n",14,"",4,NA,"sitePictures/C144a.png","sitePictures/C144b.png","sitePictures/C144c.png","sitePictures/C144d.png"
"138","rocks & minerals","","C145","Rock drumlin on 14th Line","","44.410583",-77.765917,"","y",NA,NA,163.5370587,NA,-16.23581246,"n",14,"",4,NA,"sitePictures/C145a.png","sitePictures/C145b.png","sitePictures/C145c.png","sitePictures/C145d.png"
"139","Earth History","","C146","Rock drumlinized limestone plains","","44.390808",-78.798917,"East of Lake Simcoe, between Highway 12 and Sturgeon Lake is a broad expanse of Ordovician limestone plain with thin soil cover. It has been spectacularly streamlined by glacial erosion resulting in many bullet-shaped ‘rock drumlins’ with their noses oriented to the northeast indicating southwest flow of the ice sheet. These were cut at the same time as the drumlins of the Peterborough Drumlin Field to the southeast (e.g., site <a href=""/C138"">C138</a>).","n",NA,NA,NA,NA,NA,"n",14,"",6,NA,"sitePictures/C146a.png","sitePictures/C146b.png","sitePictures/C146c.png","sitePictures/C146d.png"
"140","Earth History","","C147","ONROUTE 401 rest stop on prominent rock drumlin","","44.1092",-77.659867,"The broad bedrock rise underlying the Hiway 401 ONROUTE rest area some 4 km west of Trenton is in fact a large rock drumlin oriented southwest-northeast created by glacial streamlining of Ordovician limestone (see site <a href=""/C31"">C31</a>). It occurs along the southern margin of the Peterborough Drumlin Field where thousands of drumlins have been carved across sediment (site <a href=""/C148"">C148</a>).","y",NA,NA,139.3181005,NA,-11.14647594,"n",14,"",6,NA,"sitePictures/C147a.png","sitePictures/C147b.png","sitePictures/C147c.png","sitePictures/C147d.png"
"141","Earth History","","C148","Dummer landscape south of the Marmoraton Iron Mine (site C35)","","44.41965",77.641583,"Hummocky bouldery Dummer Moraine is well seen along St. Marks Road where it covers limestone plains immediately south of the Shield. This landscape records glacial erosion of large amounts of limestone from limestone escarpments by the last ice sheet (Site <a href=""/C48"">C48</a>) and is characteristic of much of the boundary area between the Shield and Paleozoics in central Ontario.","n",NA,NA,NA,NA,NA,"n",14,"",6,NA,"sitePictures/C148a.png","sitePictures/C148b.png","sitePictures/C148c.png","sitePictures/C148d.png"
"142","Earth History","130","E1","Barron Canyon, Algonquin Park","Ancient outlet for the Great Lakes","45.88483333",-77.63433333,"Algonquin Park has more than 1,500 kilometres of canoe routes but the best stretch of water is in Barron Canyon on the southeast corner of the park. Some 10,000 years ago, enormous volumes of water from the thawing Laurentide <a href=""/def/ice_sheet"">Ice sheet</a> thundered down the Ottawa Valley. The 100 metres deep Barron Canyon is one of the most spectacular (and most accessible) spots in Algonquin Park and was cut by meltwater escaping to the Champlain Sea (Site <a href=""/E39"">E39</a>). These cold, sediment-laden waters created the barren rock-strewn appearance of much of the park. Stands of sub-Arctic and Arctic plants still survive from that time.","n",NA,NA,NA,NA,NA,"y",15,"a",1,NA,"sitePictures/e1a.png","sitePictures/e1b.png","sitePictures/e1c.png","sitePictures/e1d.png"
"143","Rocks and Minerals","131","E2","Limerick Dam Marble","","45.58616667",-76.67016667,"Bands of white <a href=""/def/marble"">Marble</a> are conspicuous  and easily recognizable across the Canadian <a href=""/def/shield"">Shield</a> in central and eastern Ontario, often associated names like Whiterock, Whitestone, etc (Site <a href=""/E4"">E4</a>). The quality of the <a href=""/def/marble"">Marble</a> is usually poor although locally it has made very good building material. <a href=""/def/marble"">Marble</a> is produced by the alteration of <a href=""/def/limestone"">Limestone</a> under great heat and <a href=""/def/pressure"">Pressure</a>. This occurred a billion years ago during the Grenville <a href=""/def/orogeny"">Orogeny</a>. Limerick Dam has a superb <a href=""/def/outcrop"">Outcrop</a> pockilometresarked by potholes cut by the same meltwaters that eroded Barron Canyon at the end of the last <a href=""/def/ice_age"">Ice age</a> (Site <a href=""/E1"">E1</a>) Note, there are excellent example of potholes at this site.","y",NA,NA,104.03,0,8.73,"y",14,"a",5,NA,"sitePictures/e2a.png","sitePictures/e2b.png","sitePictures/e2c.png","sitePictures/e2d.png"
"144","Rocks and Minerals","132","E3","Bonnechere Caves","Rivers Underground","45.50466667",-77.009,"The Bonnechere Caves, near Renfrew, are beautiful, dark caverns formed by the slow action of water dissolving <a href=""/def/limestone"">Limestone</a>. These caves are an excellent example of<a href=""/def/_karst ""> Karst </a>caves which are caused by the slightly acidic rain water chemically <a href=""/def/weathering"">Weathering</a> <a href=""/def/limestone"">Limestone</a> and <a href=""/def/dolostone"">Dolostone</a> formations. This causes the widening of <a href=""/def/joints"">Joints</a> in the <a href=""/def/limestone"">Limestone</a> and <a href=""/def/dolostone"">Dolostone</a>, subsequently creating conduit like caves.","n",NA,NA,NA,NA,NA,"n",14,"a",5,NA,"sitePictures/e3a.png","sitePictures/e3b.png","sitePictures/e3c.png","sitePictures/e3d.png"
"145","Rocks and Minerals","133","E4","Trans-Canada Highway Marble","","45.494481",-76.668981,"Striking white <a href=""/def/outcrops"">Outcrops</a> of massive <a href=""/def/marble"">Marble</a> occur at the intersection of Highway 17 (Trans-Canada Highway) and Highway 20 (Castleford Road) just north of Renfrew along the Ottawa Valley. ","y",NA,NA,230.56,0,0.71,"n",16,"a",5,NA,"sitePictures/e4a.png","sitePictures/e4b.png","sitePictures/e4c.png","sitePictures/e4d.png"
