"","Category","dbID","siteID","SiteName","SubTitle","Lat","Lon","Desc","Sview","Sviewlat","Sviewlong","Heading","Zoom","Pitch","top","mapzoom","sponsor","Categ","ImageN","Image1","Image2","Image3","Image4"
"228","Rocks and Minerals","199","N8","The Gowganda Formation At Elliot Lake","Ancient Icebergs and Frigid Seas","46.42633333",-82.66916667,"Very old glacial rocks were discovered at Gowganda in 1905 and showed that planet Earth had experienced cold conditions very early in its history. The glacial rocks of the Gowganda<a href=""/def/_formation ""> Formation </a>were deposited as 'glaciomarine' sediments that accumulated in a deep seaway some 2400 million years ago. Pebbles and large boulders were dropped into a muddy seafloor by icebergs calved from the edge of an <a href=""/def/ice_sheet"">Ice sheet</a> lying over the Superior <a href=""/def/province"">Province</a>. This produces a very distinctive 'concrete-like' rock where stones (and often boulders) appear to 'float' in<a href=""/def/_mud ""> Mud </a>creating a 'raisin cake' appearance. The discovery of the Gowganda rocks was instrumental in exploring for other glacial rocks around the world; today some six different episodes of glaciations are recognized in the last 3 billion years. We are still in the last one (the Quaternary) and live in an <a href=""/def/interglacial"">Interglacial</a> (See Site <a href=""/S15"">S15</a>). <a href=""/def/outcrops"">Outcrops</a> of the very distinctive bouldery muds of the Gowganda<a href=""/def/_formation ""> Formation </a>can be seen in many road cuts across a broad area of northern Ontario all the way from Elliot Lake northeastward to New Liskeard. Excellent <a href=""/def/outcrops"">Outcrops</a> occur on Highway 108 north of Elliot Lake (Site <a href=""/N10"">N10</a>).","y",NA,NA,66.31,1,-5.98,"n",15,"",5,NA,"sitePictures/n8a.png","sitePictures/n8b.png","sitePictures/n8c.png","sitePictures/n8d.png"
"229","Rocks and Minerals","200","N9","Gowganda Formation At New Liskeard","Ancient Icebergs","47.451323",-79.702924,"Very old glacial rocks were discovered in northern Ontario at Gowganda in 1905. These rocks showed that planet Earth had experienced cold conditions very early in its history. The glacial rocks of the Gowganda<a href=""/def/_formation ""> Formation </a>were deposited as 'glaciomarine' sediments that accumulated in a deep seaway some 2400 million years ago. Pebbles and large boulders were dropped into a muddy seafloor by icebergs calved from the edge of an <a href=""/def/ice_sheet"">Ice sheet</a> lying over the Superior <a href=""/def/province"">Province</a>. This produces a very distinctive concrete-like rock where stones (and often boulders) appear to 'float' in<a href=""/def/_mud ""> Mud </a>creating a 'raisin cake' appearance. The discovery of the Gowganda rocks was instrumental in exploring for other glacial rocks around the world; today some six different episodes of glaciations are recognized in the last 3 billion years. We are still in the last one and live in an <a href=""/def/interglacial"">Interglacial</a> (See Site <a href=""/S15"">S15</a>). Excellent <a href=""/def/outcrops"">Outcrops</a> occur just on Highway 11 near New Liskeard (Site <a href=""/N11"">N11</a>). See also Site <a href=""/N8"">N8</a>.","y",NA,NA,194.84,0,0.39,"n",14,"",5,NA,"sitePictures/n9a.png","sitePictures/n9b.png","sitePictures/n9c.png","sitePictures/n9d.png"
"230","Rocks and Minerals","201","N10","Gowganda Formation at Kirkland Lake","Cold Seas and Glaciers","48.102",-80.19816667,"Very old glacial rocks were discovered in northern Ontario at Gowganda in 1905. These rocks showed that planet Earth had experienced cold conditions very early in its history. The glacial rocks of the Gowganda<a href=""/def/_formation ""> Formation </a>were deposited as 'glaciomarine' sediments that accumulated in a deep seaway some 2400 million years ago. Pebbles and large boulders were dropped into a muddy seafloor by icebergs calved from the edge of an <a href=""/def/ice_sheet"">Ice sheet</a> lying over the Superior <a href=""/def/province"">Province</a>. This produces a very distinctive concrete-like rock where stones (and often boulders) appear to 'float' in<a href=""/def/_mud ""> Mud </a>creating a 'raisin cake' appearance. The discovery of the Gowganda rocks was instrumental in exploring for other glacial rocks around the world; today some six different episodes of glaciations are recognized in the last 3 billion years. We are still in the last one and live in an <a href=""/def/interglacial"">Interglacial</a> (See Site <a href=""/S15"">S15</a>). See also sites <a href=""/N8"">N8</a>, <a href=""/N9"">N9</a>). Excellent Gowganda <a href=""/def/outcrops"">Outcrops</a> occur just west of Kirkland Lake (Site <a href=""/N12"">N12</a>). Many <a href=""/def/outcrops"">Outcrops</a> of the distinctive rocks can be seen along Highway 17 between Thessalon and Espanola, and in the area of Whitefish Falls on Highway 6 south of Espanola.","y",NA,NA,195.43,0,-9.28,"n",14,"",5,NA,"sitePictures/n10a.png","sitePictures/n10b.png","sitePictures/n10c.png","sitePictures/n10d.png"
"231","Earth History","202","N11","Fault Scarp at New Liskeard","","47.580752",-79.701115,"Much of the New Liskeard area was flooded by deep waters of glacial Lake Barlow at the end of the last <a href=""/def/ice_age"">Ice age</a>. This left<a href=""/def/_mud ""> Mud </a>deposits suitable for farming ('the Little<a href=""/def/_clay ""> Clay </a>Belt') among the otherwise barren rocks of the Canadian <a href=""/def/shield"">Shield</a>. The area lies astride the earthquake- prone Timiskaming <a href=""/def/graben"">Graben</a> (See Sites <a href=""/N4"">N4</a>, <a href=""/N6"">N6</a>). Just north of New Liskeard is a small cliff-nothing unusual there-except that this particular cliff is perfectly straight-for some 20 kilometres. It is likely a<a href=""/def/_faults""> Faults</a>carp produced by shifting of the ground during a major earthquake.","n",NA,NA,NA,NA,NA,"n",13,"",1,NA,"sitePictures/n11a.png","sitePictures/n11b.png","sitePictures/n11c.png","sitePictures/n11d.png"
"232","Rocks and Minerals","203","N12","Miner's Memorial","Kirkland Lake","48.1475",-80.04866667,"The Kirkland Lake Miners' Memorial  is a stark testament to the human cost of mining and the real grit needed to work underground. Many miners were immigrants from Europe who were attracted by Canada's western farmlands, only to be diverted northward by the lure of high wages.","y",48.147563,-80.04849,160.02,1,-0.79,"n",13,"",5,NA,"sitePictures/n12a.png","sitePictures/n12b.png","sitePictures/n12c.png","sitePictures/n12d.png"
"233","Rocks and Minerals","204","N13","Toburn Mine","Kirkland Lake","48.157061",-80.0213,"Like falling dominoes, the silver<a href=""/def/_strike ""> Strike </a>at Cobalt in 1903 set up a string of successive world-class<a href=""/def/_mineral ""> Mineral </a>discoveries across northern Ontario from Kirkland Lake to Timmins. Prospecting, finance and expertise flowed into the north creating fabulous wealth for the few but at a cost to individual miners and their communities, many drawn from Europe. The headframe of the Tough-Oakes Mine (later renamed Toburn Mine in 1931) and which closed in 1953 still stands (Site <a href=""/N14"">N14</a>). Production from the area peaked in 1939 but gold mining lasted for another sixty years until the close of the last of the original mines, the Macassa. The area has enjoyed a rebirth recently with much new exploration. ","y",48.157,-80.02216667,97.61,0,-3.93,"n",13,"",5,NA,"sitePictures/n13a.png","sitePictures/n13b.png","sitePictures/n13c.png","sitePictures/n13d.png"
"234","Historic","205","N14","Oakes's House","Kirkland Lake","48.14825",-80.048393,"The first gold at Kirkland Lake was found in quartz <a href=""/def/veins"">Veins</a> by Ed Hargreaves and William Wright in 1911, while out hunting rabbits. But the person forever associated with the boom is Sir Harry Oakes (murdered in 1943 under strange circumstances in the Bahamas). His Lakeshore Mine became the richest in North America (with the exception of the Homestake Mine in South Dakota). Production from the area peaked in 1939 but gold mining lasted for another sixty years until the close of the last of the original mines, the Macassa. The area has enjoyed a rebirth recently with much new exploration. Oakes' House (Site <a href=""/N4"">N4</a>) in Kirkland Lake is a now a mining museum.","y",NA,NA,43.11,0,-3.38,"n",13,"",3,NA,"sitePictures/n14a.png","sitePictures/n14b.png","sitePictures/n14c.png","sitePictures/n14d.png"
"235","Earth History","206","N15","Abitibi Greenstones","Vipond pillow Lava Basalt","48.46633333",-81.30283333,"Near Timmins, pillow <a href=""/def/lava"">Lava</a> <a href=""/def/basalt"">Basalt</a> was erupted underwater some 2.7 billion years ago. It is beautifully exposed at the Fire Tower overlooking the junction of Vipond and Moneta roads (Site <a href=""/N15"">N15</a>). Individual pillows are up to 3 metres in diametre. They are rimmed by dark green-coloured glassy <a href=""/def/basalt"">Basalt</a>. Note the round pea-shaped ""spherulites"" of white feldspar that formed within the core of the pillows","n",NA,NA,NA,NA,NA,"n",16,"",1,NA,"sitePictures/n15a.png","sitePictures/n15b.png","sitePictures/n15c.png","sitePictures/n15d.png"
"236","Rocks and Minerals","207","N16","Pearl Lake Porphyry","Rocks of the Abitibi Greenstone Belt at Timmins","48.47633333",-81.30733333,"Much of the Superior <a href=""/def/province"">Province</a> of the Canadian <a href=""/def/shield"">Shield</a> is composed of <a href=""/def/archean"">Archean</a> (>2.5 billion) metamorphic volcanic rocks that form large belts named '<a href=""/def/greenstone_belts"">Greenstone belts</a>' after their typical colour. One of the largest such belts in the world, the Abitibi <a href=""/def/greenstone_belt"">Greenstone belt</a> which consists of great thicknesses of metamorphosed volcanic rocks such as pillow <a href=""/def/lavas"">Lavas</a>, deepwater <a href=""/def/sedimentary_rocks"">Sedimentary rocks</a> (called <a href=""/def/turbidites"">Turbidites</a>) all pierced by large <a href=""/def/granite"">Granite</a> <a href=""/def/plutonic_rocks"">Plutonic rocks</a>. Check out the rear of the Comfort Inn (Site <a href=""/N17"">N17</a>) in Schumacher on Highway 101 for intensely-sheared Pearl Lake Porphyry with sub-horizontal gold-bearing quartz <a href=""/def/veins"">Veins</a>. These were worked in the nearby Hollinger Mine, which lies immediately to the south. ","n",NA,NA,NA,NA,NA,"n",16,"",5,NA,"sitePictures/n16a.png","sitePictures/n16b.png","sitePictures/n16c.png","sitePictures/n16d.png"
"237","Earth History","208","N17","Turbidites of the Abitibi Greenstone Belt","","48.49383333",-81.20333333,"Much of the Canadian <a href=""/def/shield"">Shield</a> in northern Ontario is composed of 2.5 billion-year-old volcanic rocks that form large ""<a href=""/def/greenstone_belts"">Greenstone belts</a>"" named after their typical colour. One of the largest such belts in the world, the Abitibi <a href=""/def/greenstone_belt"">Greenstone belt</a> has been a source of enormous wealth with world-class deposits of copper-zinc-lead, gold, nickel-copper, and others. It consists of very thick accumulations of metamorphosed volcanic rocks, such as pillow <a href=""/def/lavas"">Lavas</a> (<a href=""/N15"">N15</a>), and <a href=""/def/sedimentary_rocks"">Sedimentary rocks</a> deposited in the deep waters of an ancient ocean basin by downslope slumping and flow. These are called <a href=""/def/turbidites"">Turbidites</a> because they moved downslope as turbulent mixtures of water and<a href=""/def/_sediment ""> Sediment </a>much like a snow avalanche (<a href=""/C40"">C40</a>). Fantastic <a href=""/def/exposures"">Exposures</a> of <a href=""/def/turbidites"">Turbidites</a> of the Timiskaming<a href=""/def/_series ""> Series </a>occur on the north side of Ferguson Avenue in South Porcupine just east of Crawford Street. ","n",NA,NA,NA,NA,NA,"n",13,"",1,NA,"sitePictures/n17a.png","sitePictures/n17b.png","sitePictures/n17c.png","sitePictures/n17d.png"
"238","Earth History","209","N18","Green pebbles in Conglomerates","Abitibi Greenstones","48.545343",-80.899898,"Much of the Canadian <a href=""/def/shield"">Shield</a> in northern Ontario is composed of 2.5 billion-year-old volcanic rocks that form large ""<a href=""/def/greenstone_belts"">Greenstone belts</a>"" named after their typical color. One of the largest such belts in the world, the Abitibi <a href=""/def/greenstone_belt"">Greenstone belt</a> has been a source of enormous wealth with world-class deposits of copper-zinc-lead, gold, nickel-copper, and others. It consists of very thick accumulations of metamorphosed volcanic rocks, such as pillow <a href=""/def/lavas"">Lavas</a> (<a href=""/N15"">N15</a>), and deep water <a href=""/def/sedimentary_rocks"">Sedimentary rocks</a> deposited in the deep waters of an ancient ocean basin by downslope slumping and flow (<a href=""/N17"">N17</a>). These are called <a href=""/def/turbidites"">Turbidites</a> because they moved downslope as turbulent mixtures of water and<a href=""/def/_sediment ""> Sediment </a>much like a snow avalanche. These are well exposed on the north side of Highway 101 immediately west of the intersection with Municipal Road (old Highway 67 which leads up to <a href=""/def/kettle_lakes"">Kettle lakes</a> Provincial Park) where <a href=""/def/conglomerates"">Conglomerates</a> show bright green pebbles of metamorphosed <a href=""/def/basalt"">Basalt</a> altered to a bright green color by the<a href=""/def/_mineral ""> Mineral </a>fuchsite. ","y",NA,NA,8.03,0,4.88,"n",14,"",1,NA,"sitePictures/n18a.png","sitePictures/n18b.png","sitePictures/n18c.png","sitePictures/n18d.png"
"239","Rocks and Minerals","210","N19","Timmins","Gold Aplenty","48.479849",-81.298574,"Timmins was named in 1912 after the famous prospector Noah Timmins. The city grew out of the 1909 discovery of gold rich quartz <a href=""/def/veins"">Veins</a> that <a href=""/def/outcrop"">Outcrop</a> at Porcupine, on the shore of Porcupine Lake. This discovery heralded one of the biggest gold rushes in Ontario history. To date, more than 75 million ounces of gold have been produced from rocks of the Abitibi <a href=""/def/greenstone_belt"">Greenstone belt</a>, only exceeded by the famous Witwatersrand mines of South Africa. Take the underground gold mine discovery tour while in Timmins and drive the self-guided mining tour. Check out the Timmins Chamber of Commerce for information and maps. ","y",NA,NA,265.25,0,-6.45,"y",16,"",5,NA,"sitePictures/n19a.png","sitePictures/n19b.png","sitePictures/n19c.png","sitePictures/n19d.png"
"240","Historic","211","N20","French River and the Voyageurs","Water Road Truckers","46.01633333",-80.58216667,"In the early 1600s, at the time of European contact, the Canadian <a href=""/def/shield"">Shield</a> was occupied by small, migratory bands of Algonkian speaking trappers and hunters. They swapped furs for corn and dried meat from the sedentary Iroquois-speaking Huron who farmed to the south. This became the basis for a European fur trade that was determined by the waterways of northern Canada. Visit the interpretation centre on Highway 69 immediately south of the bridge across the French River.  ","n",NA,NA,NA,NA,NA,"n",16,"",3,NA,"sitePictures/n20a.png","sitePictures/n20b.png","sitePictures/n20c.png","sitePictures/n20d.png"
"241","Earth History","212","N21","The Grenville Front Tectonic Zone on Highway 69","Sudbury","46.420612",-80.882871,"Just south of Sudbury, the traveler driving along Highway 69 will get a rare glimpse of one of the most dramatic geologic boundaries anywhere in Ontario - if not in Canada. To the north lies rocks that are roughly 2.9 -1.6 billion years old. A major thrust fault, called the Grenville Front Tectonic Zone, separates these two kinds of rock from the much younger (< 1.5 billion years old) metamorphic rocks of the Grenville <a href=""/def/province"">Province</a> to the south. This abrupt boundary is where the eastern margin of North America (""<a href=""/def/laurentia"">Laurentia</a>"") once lay when part of South America slammed into it forming huge mountains. Looking east along the swamp on Highway 69 it can be seen, as well as in the community of Wahnapitae 10 kilometres east of Sudbury on Highway 17. The new highway 400 is being developed through this area and new road cuts are being opened up.","y",NA,NA,27.29,0,-7.87,"n",16,"",1,NA,"sitePictures/n21a.png","sitePictures/n21b.png","sitePictures/n21c.png","sitePictures/n21d.png"
"242","Earth History","213","N22","The Grenville Front Tectonic Zone","Wahnapitae","46.48766667",-80.79083333,"Steeply dipping Huronian rocks pushed up along the GFTZ are easily seen in the small community of Wahnapitae on Highway 17 some 10 kilometres east of Sudbury . It's incredible to think that long ago, mountains that rivalled the Himalayas stood above these two sites.","y",NA,NA,31.06,1,-9.4,"n",16,"",1,NA,"sitePictures/n22a.png","sitePictures/n22b.png","sitePictures/n22c.png","sitePictures/n22d.png"
"243","Rocks and Minerals","214","N23","Murray Mine","","46.516528",-81.053334,"Sudbury's impressive mining history began in 1883 when copper<a href=""/def/_ore ""> Ore </a>was found in rock cuts made to facilitate the Canadian Pacific Railway. At first, mining concentrated on copper extraction, but with the arms race between Britain and Germany before the First World War, Canadian nickel mining at Sudbury really took off. The construction of heavily armoured ""dreadnought"" battle cruisers vastly increased demand.","y",NA,NA,273.56,0,-10.38,"n",16,"",5,NA,"sitePictures/n23a.png","sitePictures/n23b.png","sitePictures/n23c.png","sitePictures/n23d.png"
"244","Rocks and Minerals","215","N24","Dynamic Earth and The Big Nickel","","46.473867",-81.033194,"At Dynamic Earth and the Big Nickel At Dynamic Earth , visitors can explore the seven-storey deep ""Inco Chasm"" and underground mining tunnels. The Big Nickel is a replica of a 1951 nickel coin bearing the head of George VI. The big coin was built to celebrate the 200th anniversary of the experiment by Swedish chemist Axel Fredrik Cronstedt, who was the first to successfully isolate nickel as an element.","y",46.473908,-81.035285,96.64,0,-0.31,"y",16,"",5,NA,"sitePictures/n24a.png","sitePictures/n24b.png","sitePictures/n24c.png","sitePictures/n24d.png"
"245","Rocks and Minerals","216","N25","Copper Cliff Museum","","46.473668",-81.066685,"Copper Cliff Museum, A log cabin dating from 1885 is preserved in Copper Cliff as if it still housed a 19thcentury miner and his family. The museum also contains an extensive collection of photographs chronicling the rich history of mining in the area.","y",NA,NA,274.85,0,-1.57,"n",16,"",5,NA,"sitePictures/n25a.png","sitePictures/n25b.png","sitePictures/n25c.png","sitePictures/n25d.png"
"246","Earth History","217","N26","Shatter Cones","","46.468122",-80.980397,"Shatter cones are produced by violent shock waves during <a href=""/def/meteorite"">Meteorite</a> impact. They occur in a belt that surrounds the Sudbury Structure  and testify to the violent impact caused by the 10 kilometre wide <a href=""/def/meteorite"">Meteorite</a>. They are most accessible along Ramsey Lake Road on the way up to the campus of <a href=""/def/laurentia"">Laurentia</a>n University.","y",NA,NA,118.69,0,-8.18,"n",16,"",1,NA,"sitePictures/n26a.png","sitePictures/n26b.png","sitePictures/n26c.png","sitePictures/n26d.png"
"247","Rocks and Minerals","218","N27","Chelmsford Concretions","","46.573567",-81.288329,"Chelmsford concretions the last stage in the history of the <a href=""/def/meteorite"">Meteorite</a> crater was its infilling with seawaters and great thicknesses of <a href=""/def/sedimentary_rocks"">Sedimentary rocks</a>. The Chelmsford<a href=""/def/_formation ""> Formation </a>exposed on Highway 144, just east of Dowling, shows distinctive circular concretions made of carbonate. They are diagenetic in origin, meaning they were formed during <a href=""/def/lithification"">Lithification</a> ","y",NA,NA,65.04,0,3.78,"n",15,"",5,NA,"sitePictures/n27a.png","sitePictures/n27b.png","sitePictures/n27c.png","sitePictures/n27d.png"
"248","Rocks and Minerals","219","N28","Onaping Falls","","46.587661",-81.380348,"The best place to view the varied rocks of the Sudbury Impact Structure is at Onaping Falls on Highway 144. A wonderful collection of rock has been assembled there that illustrates the entire <a href=""/def/stratigraphy"">Stratigraphy</a> of the basin, including the ""salt and pepper"" <a href=""/def/norite"">Norite</a> rock that lines the basin, the violently pulverized rock of the Sudbury <a href=""/def/breccia"">Breccia</a>, the brassy copper-nickel<a href=""/def/_ore ""> Ore </a>that lies above, and the glassy ""fall back debris"" that blanketed and partly filled the crater. Onaping Falls was a favorite subject of artists such as A.Y. Jackson of the Group of Seven.","n",NA,NA,NA,NA,NA,"n",15,"",5,NA,"sitePictures/n28a.png","sitePictures/n28b.png","sitePictures/n28c.png","sitePictures/n28d.png"
"249","Earth History","220","N29","Sudbury Breccia","","46.63133333",-81.462,"At Windy Lake Highway 144 North cuts through superb <a href=""/def/outcrops"">Outcrops</a> of the Sudbury <a href=""/def/breccia"">Breccia</a> which formed when <a href=""/def/archean"">Archean</a> <a href=""/def/gneiss"">Gneiss</a> with a prominent dark-coloured<a href=""/def/_dike ""> Dike </a>was <a href=""/def/fracture"">Fracture</a>d (<a href=""/def/breccia"">Breccia</a>ted) during <a href=""/def/meteorite"">Meteorite</a> impact. Look out for thin lens-shaped beds of glass-like ""pseudotachlyite"" where broken rock was melted by the heat of impact among the chaotic <a href=""/def/breccia"">Breccia</a>.","n",NA,NA,NA,NA,NA,"n",14,"",1,NA,"sitePictures/n29a.png","sitePictures/n29b.png","sitePictures/n29c.png","sitePictures/n29d.png"
"250","Earth History","221","N30","Pitted Outwash and Kettle Holes","","46.620285",-80.793083,"The road passes by Sudbury Airport on the left and affords dramatic views of what is called ""pitted"" or ""kettled"" <a href=""/def/outwash"">Outwash</a>. The airport is built on the extensive flat surface of an <a href=""/def/outwash"">Outwash</a> <a href=""/def/gravel"">Gravel</a> plain left by rivers when the last <a href=""/def/ice_sheet"">Ice sheet</a> melted and withdrew 11,000 years ago. The ice margin lay at the south end of Lake Wanapitei, feeding <a href=""/def/gravel"">Gravel</a> and<a href=""/def/_sands""> Sands</a>outh into Glacial Lake Algonquin. This was an enormous lake which at one time drained eastward through North Bay down the Ottawa Valley","n",NA,NA,NA,NA,NA,"n",14,"",1,NA,"sitePictures/n30a.png","sitePictures/n30b.png","sitePictures/n30c.png","sitePictures/n30d.png"
"251","Earth History","222","N31","Wanapitei Lake","","46.68383333",-80.74783333,"Sudbury can truly be called the impact capital of Ontario, Wanapitei Lake (<a href=""/N31"">N31</a>) north of Sudbury Airport fills another <a href=""/def/meteorite"">Meteorite</a> impact basin, but one much younger than the Sudbury basin. The dating of impact debris, along the southern shore of the lake suggests a 37 million year old impact.","n",NA,NA,NA,NA,NA,"n",14,"",1,NA,"sitePictures/n31a.png","sitePictures/n31b.png","sitePictures/n31c.png","sitePictures/n31d.png"
"252","Earth History","223","N32","Espanola Turbidites","","46.27066667",-81.77766667,"Two and a half billion years ago northern Ontario was a quiet place-but it did not remain so for very long. The old rocks of the Superior <a href=""/def/province"">Province</a> were soon buried under thick layers of Huronian <a href=""/def/sandstone"">Sandstone</a> and <a href=""/def/shale"">Shale</a>. These record a large seaway lapping up against the Superior <a href=""/def/province"">Province</a> to the north. Distinct layers of <a href=""/def/sandstone"">Sandstone</a> that were deposited deep underwater on an ancient submarine slope are now exposed in road cuts on Highway 6 immediately north of Espanola and the Serpent River","y",NA,NA,356.21,0,-18.09,"n",14,"",1,NA,"sitePictures/n32a.png","sitePictures/n32b.png","sitePictures/n32c.png","sitePictures/n32d.png"
"253","Earth History","224","N33","Penokean Thrust and Fold Belts","","46.12849",-81.736525,"The drive south along Highway 6 from Espanola to Manitoulin Island takes us across a classic example of a ""fold and thrust"" belt. The road cuts through ridge after ridge of steeply dipping Huronian marine <a href=""/def/sedimentary_rocks"">Sedimentary rocks</a> that are about 2.4 billion years old. <a href=""/def/sedimentary_rocks"">Sedimentary rocks</a> of an ancient seaway were pushed north and crumpled during the Penokean <a href=""/def/orogeny"">Orogeny</a> 1.8 billion years ago, forming a high mountain range. This has been worn down to expose the deformed rocks that today, create the rugged relief of the La Cloche Mountains.","y",46.127661,-81.73584,40.59,0,-15.18,"n",16,"",1,NA,"sitePictures/n33a.png","sitePictures/n33b.png","sitePictures/n33c.png","sitePictures/n33d.png"
